{
  "content_file": "content.json",
  "thesis": "稳定的网页演示来自内容、叙事、关系、版式和组件的连续判断，而不是随机套模板。",
  "narrative_type": "problem-solution",
  "page_budget": {
    "min": 6, "max": 6, "target": 6,
    "drivers": [
      {"type": "independent_claim", "count": 6, "reason": "问题、流程、原则、版式、组件和行动各自回答一个独立观众问题。"}
    ],
    "reason": "六个独立主张组成从问题到方法、再到行动的完整能力介绍。"
  },
  "confirmation": {"mode": "adaptive", "decision": "proceed", "triggers": [], "questions": []},
  "sections": [
    {"section_id": "section.problem", "title": "问题与标准", "purpose": "说明 AI 演示同质化的根因。", "page_refs": ["page.story.why"]},
    {"section_id": "section.workflow", "title": "从内容到放映", "purpose": "解释标准网页演示的编排链。", "page_refs": ["page.story.workflow"]},
    {"section_id": "section.design", "title": "设计取舍", "purpose": "定义页面阅读顺序的三项原则。", "page_refs": ["page.story.principles"]},
    {"section_id": "section.expression", "title": "表达资源", "purpose": "说明版式与组件如何按关系和内容调用。", "page_refs": ["page.story.layout-atlas", "page.story.component-atlas"]},
    {"section_id": "section.close", "title": "保持联系", "purpose": "给出继续关注的明确路径。", "page_refs": ["page.story.contact"]}
  ],
  "pages": [
    {
      "page_id": "page.story.why", "order": 1, "section_id": "section.problem", "role": "compare",
      "assertion_title": "AI 做 PPT 总是千篇一律，因为缺的是设计判断",
      "audience_question": "AI 已经能生成页面，为什么结果还是相似？",
      "takeaway": "AI 缺的不是生成页面的能力，而是好的设计标准。",
      "content_refs": ["item.story.why", "item.story.why-takeaway"], "evidence_refs": ["item.story.why"],
      "relation_shape": {"primary": "comparison", "secondary": ["mapping"], "reason": "左侧问题与右侧设计决策形成逐项对照。"},
      "spatial_primitive": "bilateral-split", "semantic_unit_count": 2, "density_intent": "balanced",
      "blocks": [
        {"block_id": "block.story.why-comparison", "purpose": "对照默认输出与演示意图", "importance": "primary", "semantic_form": "diagram", "content_refs": ["item.story.why"]},
        {"block_id": "block.story.why-takeaway", "purpose": "收束根因判断", "importance": "support", "semantic_form": "prose", "content_refs": ["item.story.why-takeaway"]}
      ]
    },
    {
      "page_id": "page.story.workflow", "order": 2, "section_id": "section.workflow", "role": "explain",
      "assertion_title": "五步编排链把原始资料变成可放映网页",
      "audience_question": "Wise PPT 如何把内容转成演示？",
      "takeaway": "先理解内容，再安排重点、层级与关系。",
      "content_refs": ["item.story.workflow", "item.story.workflow-takeaway"], "evidence_refs": [],
      "relation_shape": {"primary": "flow", "secondary": ["sequence"], "reason": "五个阶段存在明确的输入输出顺序。"},
      "spatial_primitive": "linear-sequence", "semantic_unit_count": 2, "density_intent": "balanced",
      "blocks": [
        {"block_id": "block.story.workflow", "purpose": "展示五步工作流", "importance": "primary", "semantic_form": "process", "content_refs": ["item.story.workflow"]},
        {"block_id": "block.story.workflow-takeaway", "purpose": "明确内容优先原则", "importance": "support", "semantic_form": "prose", "content_refs": ["item.story.workflow-takeaway"]}
      ]
    },
    {
      "page_id": "page.story.principles", "order": 3, "section_id": "section.design", "role": "explain",
      "assertion_title": "一页一个重心，三项原则共同决定阅读顺序",
      "audience_question": "什么样的设计判断能避免模板化？",
      "takeaway": "设计不是把信息填满，而是为观众的阅读顺序作出取舍。",
      "content_refs": ["item.story.principles", "item.story.principles-takeaway"], "evidence_refs": [],
      "relation_shape": {"primary": "decomposition", "secondary": ["focus"], "reason": "三个原则围绕一个中心设计意图展开。"},
      "spatial_primitive": "radial-burst", "semantic_unit_count": 2, "density_intent": "balanced",
      "blocks": [
        {"block_id": "block.story.design-principles", "purpose": "呈现中心判断与三项原则", "importance": "primary", "semantic_form": "diagram", "content_refs": ["item.story.principles"]},
        {"block_id": "block.story.principles-takeaway", "purpose": "收束阅读顺序判断", "importance": "support", "semantic_form": "prose", "content_refs": ["item.story.principles-takeaway"]}
      ]
    },
    {
      "page_id": "page.story.layout-atlas", "order": 4, "section_id": "section.expression", "role": "explain",
      "assertion_title": "版式图册提供结构候选，但内容关系拥有最终决定权",
      "audience_question": "版式库是强制模板，还是按关系选择的参考？",
      "takeaway": "从信息关系出发，让每一种内容都拥有恰当的阅读结构。",
      "content_refs": ["item.story.layout-atlas", "item.story.layout-atlas-takeaway"], "evidence_refs": ["item.story.layout-atlas"],
      "relation_shape": {"primary": "decomposition", "secondary": ["spatial"], "reason": "左侧原则与右侧六种结构样本形成总分说明。"},
      "spatial_primitive": "bilateral-split", "semantic_unit_count": 2, "density_intent": "balanced",
      "blocks": [
        {"block_id": "block.story.layout-atlas", "purpose": "解释规则并展示六种结构样本", "importance": "primary", "semantic_form": "diagram", "content_refs": ["item.story.layout-atlas"]},
        {"block_id": "block.story.layout-atlas-takeaway", "purpose": "明确关系优先", "importance": "support", "semantic_form": "prose", "content_refs": ["item.story.layout-atlas-takeaway"]}
      ]
    },
    {
      "page_id": "page.story.component-atlas", "order": 5, "section_id": "section.expression", "role": "explain",
      "assertion_title": "组件沉淀成熟表达，但是否调用仍由页面内容决定",
      "audience_question": "组件库会不会反过来限制页面表达？",
      "takeaway": "提供成熟的表达组件，并由页面内容决定是否调用。",
      "content_refs": ["item.story.component-atlas", "item.story.component-atlas-takeaway"], "evidence_refs": ["item.story.component-atlas"],
      "relation_shape": {"primary": "decomposition", "secondary": ["spatial"], "reason": "左侧调用原则与右侧六种组件样本共同解释组件边界。"},
      "spatial_primitive": "bilateral-split", "semantic_unit_count": 2, "density_intent": "balanced",
      "blocks": [
        {"block_id": "block.story.component-atlas", "purpose": "解释调用原则并展示六类组件", "importance": "primary", "semantic_form": "diagram", "content_refs": ["item.story.component-atlas"]},
        {"block_id": "block.story.component-atlas-takeaway", "purpose": "明确内容决定调用", "importance": "support", "semantic_form": "prose", "content_refs": ["item.story.component-atlas-takeaway"]}
      ]
    },
    {
      "page_id": "page.story.contact", "order": 6, "section_id": "section.close", "role": "act",
      "assertion_title": "通过三条可执行渠道继续获取 Wise PPT 更新",
      "audience_question": "在哪里可以继续关注更新？",
      "takeaway": "关注 @歪斯Wise，及时获取更新资讯。",
      "content_refs": ["item.story.contact", "item.story.contact-takeaway"], "evidence_refs": [],
      "relation_shape": {"primary": "hierarchy", "secondary": ["focus"], "reason": "联络卡承担主行动，辅助网格和渠道列表补充路径。"},
      "spatial_primitive": "layered-stack", "semantic_unit_count": 2, "density_intent": "balanced",
      "blocks": [
        {"block_id": "block.story.contact", "purpose": "展示联络渠道与二维码", "importance": "primary", "semantic_form": "cta", "content_refs": ["item.story.contact"]},
        {"block_id": "block.story.contact-takeaway", "purpose": "给出关注行动", "importance": "support", "semantic_form": "cta", "content_refs": ["item.story.contact-takeaway"]}
      ]
    }
  ],
  "coverage_decisions": [
    {"content_ref": "item.story.why", "disposition": "include", "page_refs": ["page.story.why"], "reason": "问题对照主证据。"},
    {"content_ref": "item.story.why-takeaway", "disposition": "include", "page_refs": ["page.story.why"], "reason": "问题页结论。"},
    {"content_ref": "item.story.workflow", "disposition": "include", "page_refs": ["page.story.workflow"], "reason": "五步工作流。"},
    {"content_ref": "item.story.workflow-takeaway", "disposition": "include", "page_refs": ["page.story.workflow"], "reason": "流程页结论。"},
    {"content_ref": "item.story.principles", "disposition": "include", "page_refs": ["page.story.principles"], "reason": "三项设计原则。"},
    {"content_ref": "item.story.principles-takeaway", "disposition": "include", "page_refs": ["page.story.principles"], "reason": "原则页结论。"},
    {"content_ref": "item.story.layout-atlas", "disposition": "include", "page_refs": ["page.story.layout-atlas"], "reason": "版式结构样本。"},
    {"content_ref": "item.story.layout-atlas-takeaway", "disposition": "include", "page_refs": ["page.story.layout-atlas"], "reason": "版式页结论。"},
    {"content_ref": "item.story.component-atlas", "disposition": "include", "page_refs": ["page.story.component-atlas"], "reason": "组件能力样本。"},
    {"content_ref": "item.story.component-atlas-takeaway", "disposition": "include", "page_refs": ["page.story.component-atlas"], "reason": "组件页结论。"},
    {"content_ref": "item.story.contact", "disposition": "include", "page_refs": ["page.story.contact"], "reason": "联络路径。"},
    {"content_ref": "item.story.contact-takeaway", "disposition": "include", "page_refs": ["page.story.contact"], "reason": "行动结论。"}
  ]
}
